{
  "schema": "https://openmanuscript.org/schemas/omi-manuscript-0.3.schema.json",
  "omi": {
    "format": "manuscript",
    "version": "0.3.0",
    "profiles": [
      "core-snapshot"
    ],
    "specifications": {
      "OMI-SPEC-100": "0.1.0",
      "OMI-SPEC-120": "0.2.0",
      "OMI-SPEC-140": "0.1.0",
      "OMI-SPEC-225": "0.1.0"
    }
  },
  "id": "urn:uuid:924ac355-f66c-4f2d-9946-dd25a7ac4775",
  "locale": "en",
  "title": "Minimal portable manuscript",
  "sections": [
    {
      "id": "section-introduction",
      "title": "Introduction",
      "blocks": [
        {
          "id": "block-opening",
          "type": "paragraph",
          "content": "A portable scholarly paragraph."
        }
      ]
    }
  ],
  "createdAt": "2026-09-05T08:00:00Z",
  "updatedAt": "2026-09-05T08:00:00Z",
  "sourceAttributions": []
}
